{
  "audit_report_id": "CYCLE-000018:358c547e5d65",
  "cycle_id": "CYCLE-000018",
  "findings": [
    {
      "disposition": "ACCEPT_AND_FIX",
      "evidence": "This cycle audited 27dd4bd2, a snapshot from the re-audit request queued BEFORE CYCLE-000017 raised this finding; the report itself notes the fix commit is not an ancestor of the audited snapshot. The fix exists at a6bddfe82224c6b952257ea4a321abb6ff6879d7 (identical disposition in CYCLE-000017) and is contained in a01e54cf, whose audit is already queued and should verify closure. Fix content: both surviving NOT-CITABLE sentences in the Q3 block are explicitly historical with closure pointers; one current status (CITABLE) remains.",
      "finding_id": "F-019",
      "fix_commit": "a6bddfe82224c6b952257ea4a321abb6ff6879d7"
    },
    {
      "disposition": "ACCEPT_AND_FIX",
      "evidence": "This cycle audited 27dd4bd2, a snapshot from the re-audit request queued BEFORE CYCLE-000017 raised this finding; the report itself notes the fix commit is not an ancestor of the audited snapshot. The fix exists at a6bddfe82224c6b952257ea4a321abb6ff6879d7 (identical disposition in CYCLE-000017) and is contained in a01e54cf, whose audit is already queued and should verify closure. Fix content: regression [43] now fails on CITABLE + any NOT-CITABLE whose own \u00b11-line context lacks a historical marker; fixture is the exact mixed-state form, verified failing by block line number.",
      "finding_id": "F-020",
      "fix_commit": "a6bddfe82224c6b952257ea4a321abb6ff6879d7"
    },
    {
      "disposition": "ACCEPT_AND_FIX",
      "evidence": "This cycle audited 27dd4bd2, a snapshot from the re-audit request queued BEFORE CYCLE-000017 raised this finding; the report itself notes the fix commit is not an ancestor of the audited snapshot. The fix exists at a6bddfe82224c6b952257ea4a321abb6ff6879d7 (identical disposition in CYCLE-000017) and is contained in a01e54cf, whose audit is already queued and should verify closure. Fix content: the bare q3_raw/derive_q3.py locator fully qualified; no bare q3_raw locators remain in the index.",
      "finding_id": "F-021",
      "fix_commit": "a6bddfe82224c6b952257ea4a321abb6ff6879d7"
    }
  ],
  "report_sha256": "358c547e5d6506602de72f585f8b21fa8808a8be76fa86175e0de588a9cf12ff",
  "report_sha256_confirmed": true
}
